{
  "$schema": "https://json-schema.org/draft/2020-12/schema",
  "$id": "https://sanjai.local/schemas/user_profile.json",
  "title": "UserProfile",
  "type": "object",
  "required": [
    "user_id",
    "display_name",
    "locale",
    "familiarity_lv",
    "preferred_domains",
    "updated_at"
  ],
  "properties": {
    "user_id": {
      "type": "string",
      "format": "uuid"
    },
    "display_name": {
      "type": "string"
    },
    "locale": {
      "type": "string",
      "enum": [
        "zh-HK",
        "zh-CN",
        "en"
      ]
    },
    "familiarity_lv": {
      "type": "integer",
      "minimum": 1,
      "maximum": 5
    },
    "preferred_domains": {
      "type": "array",
      "items": {
        "type": "string",
        "enum": [
          "health",
          "study",
          "work",
          "romance",
          "family",
          "friends"
        ]
      }
    },
    "timezone": {
      "type": "string"
    },
    "updated_at": {
      "type": "string",
      "format": "date-time"
    },
    "calibration": {
      "type": "string",
      "enum": [
        "matched",
        "needs_confirm",
        "skipped",
        "pending"
      ],
      "description": "Client-safe dial status only; never includes birth_vault"
    },
    "onboarding_complete": {
      "type": "boolean"
    },
    "interests": {
      "type": "array",
      "maxItems": 12,
      "items": { "type": "string", "maxLength": 40 },
      "description": "Client-kept chips/labels for chat memory; never fortune input or birth"
    }
  },
  "additionalProperties": false,
  "description": "birth_vault is server-only and must never appear on this schema. Client may keep display_name, interests, calibration."
}
