{
  "user_id": "00000000-0000-4000-8000-000000000001",
  "display_name": "Kev",
  "locale": "zh-HK",
  "familiarity_lv": 1,
  "preferred_domains": [
    "health",
    "work",
    "family"
  ],
  "timezone": "Asia/Hong_Kong",
  "updated_at": "2026-09-08T16:00:00Z",
  "calibration": "pending",
  "onboarding_complete": false
}
